[
  {
    "run_id": "run_2025-10-12T14-29-03Z",
    "role": "Auditor",
    "model": {
      "name": "scope-validator",
      "provider": "local"
    },
    "tools": {},
    "artifacts": [
      "runs/run_2025-10-12T14-29-03Z/scope/summary.json"
    ],
    "hashes": {
      "runs/run_2025-10-12T14-29-03Z/scope/summary.json": "sha256:511f1ac9d1f98ab4680d676dfe7179b32d69689249ac78b9da40284476e94cb0"
    },
    "started": "2025-10-12T14:29:03Z",
    "ended": "2025-10-12T14:29:03Z",
    "notes": "Scope/testability validation"
  },
  {
    "run_id": "run_2025-10-12T14-29-03Z",
    "role": "Proposer",
    "model": {
      "name": "echo",
      "provider": "local",
      "version": "fallback"
    },
    "prompt_id": "sha256:578a2f6520898bbcfc36430440a50f606b68502af89726d17856206c853138dd",
    "seed": 123,
    "tools": {},
    "artifacts": [],
    "hashes": {},
    "started": "2025-10-12T14:29:03Z",
    "ended": "2025-10-12T14:29:03Z",
    "notes": "fanout_generate"
  },
  {
    "run_id": "run_2025-10-12T14-29-03Z",
    "role": "Proposer",
    "model": {
      "name": "upper",
      "provider": "local",
      "version": "fallback"
    },
    "prompt_id": "sha256:578a2f6520898bbcfc36430440a50f606b68502af89726d17856206c853138dd",
    "seed": 123,
    "tools": {},
    "artifacts": [],
    "hashes": {},
    "started": "2025-10-12T14:29:03Z",
    "ended": "2025-10-12T14:29:03Z",
    "notes": "fanout_generate"
  },
  {
    "run_id": "run_2025-10-12T14-29-03Z",
    "role": "Proposer",
    "model": {
      "name": "reverse",
      "provider": "local",
      "version": "fallback"
    },
    "prompt_id": "sha256:578a2f6520898bbcfc36430440a50f606b68502af89726d17856206c853138dd",
    "seed": 123,
    "tools": {},
    "artifacts": [],
    "hashes": {},
    "started": "2025-10-12T14:29:03Z",
    "ended": "2025-10-12T14:29:03Z",
    "notes": "fanout_generate"
  },
  {
    "run_id": "run_2025-10-12T14-29-03Z",
    "role": "Editor",
    "model": {
      "name": "write-text",
      "provider": "local"
    },
    "tools": {},
    "artifacts": [
      "runs/run_2025-10-12T14-29-03Z/artifacts/notes/fanout.txt"
    ],
    "hashes": {
      "runs/run_2025-10-12T14-29-03Z/artifacts/notes/fanout.txt": "sha256:8277c13ce99bbd390be14fb97dd9dd4c01b58a25ac4a851c4334aa4904abfbad"
    },
    "started": "2025-10-12T14:29:03Z",
    "ended": "2025-10-12T14:29:03Z",
    "notes": "emit artifact"
  },
  {
    "run_id": "run_2025-10-12T14-29-03Z",
    "role": "Consensus",
    "model": {
      "name": "majority-vote",
      "provider": "local"
    },
    "tools": {},
    "artifacts": [],
    "hashes": {},
    "started": "2025-10-12T14:29:03Z",
    "ended": "2025-10-12T14:29:03Z",
    "notes": "voters=['echo', 'upper'], agreement_ratio=0.67"
  },
  {
    "run_id": "run_2025-10-12T14-29-03Z",
    "role": "Editor",
    "model": {
      "name": "write-text",
      "provider": "local"
    },
    "tools": {},
    "artifacts": [
      "runs/run_2025-10-12T14-29-03Z/artifacts/notes/consensus.json"
    ],
    "hashes": {
      "runs/run_2025-10-12T14-29-03Z/artifacts/notes/consensus.json": "sha256:578a2f6520898bbcfc36430440a50f606b68502af89726d17856206c853138dd"
    },
    "started": "2025-10-12T14:29:03Z",
    "ended": "2025-10-12T14:29:03Z",
    "notes": "emit artifact"
  },
  {
    "run_id": "run_2025-10-12T14-29-03Z",
    "role": "Auditor",
    "model": {
      "name": "assert-contains",
      "provider": "local"
    },
    "tools": {},
    "artifacts": [],
    "hashes": {},
    "started": "2025-10-12T14:29:03Z",
    "ended": "2025-10-12T14:29:03Z",
    "notes": "must_include=['battery lasts all day', 'ui is confusing']; missing=[]"
  },
  {
    "run_id": "run_2025-10-12T14-29-03Z",
    "role": "Auditor",
    "model": {
      "name": "human-gate",
      "provider": "local"
    },
    "tools": {},
    "artifacts": [],
    "hashes": {},
    "started": "2025-10-12T14:29:03Z",
    "ended": "2025-10-12T14:29:03Z",
    "notes": "checklist=templates/audit-checklist.md"
  }
]