[
  {
    "run_id": "run_2025-09-16T22-34-56Z",
    "role": "Auditor",
    "model": {
      "name": "scope-validator",
      "provider": "local"
    },
    "artifacts": [
      "/home/runner/work/AI-Workflow-Orchestration/AI-Workflow-Orchestration/runs/run_2025-09-16T22-34-56Z/scope/summary.json"
    ],
    "hashes": {
      "/home/runner/work/AI-Workflow-Orchestration/AI-Workflow-Orchestration/runs/run_2025-09-16T22-34-56Z/scope/summary.json": "sha256:718fb1026c048dce441ededcc7a70e34f1471495c4569170b1606fffdef654e2"
    },
    "started": "2025-09-16T22:34:56Z",
    "ended": "2025-09-16T22:34:56Z",
    "notes": "Scope/testability validation"
  },
  {
    "run_id": "run_2025-09-16T22-34-56Z",
    "role": "Proposer",
    "model": {
      "name": "echo",
      "provider": "local",
      "version": "fallback"
    },
    "seed": 123,
    "artifacts": [],
    "hashes": {},
    "started": "2025-09-16T22:34:56Z",
    "ended": "2025-09-16T22:34:56Z",
    "prompt_id": "sha256:578a2f652089",
    "notes": "fanout_generate"
  },
  {
    "run_id": "run_2025-09-16T22-34-56Z",
    "role": "Proposer",
    "model": {
      "name": "upper",
      "provider": "local",
      "version": "fallback"
    },
    "seed": 123,
    "artifacts": [],
    "hashes": {},
    "started": "2025-09-16T22:34:56Z",
    "ended": "2025-09-16T22:34:56Z",
    "prompt_id": "sha256:578a2f652089",
    "notes": "fanout_generate"
  },
  {
    "run_id": "run_2025-09-16T22-34-56Z",
    "role": "Proposer",
    "model": {
      "name": "reverse",
      "provider": "local",
      "version": "fallback"
    },
    "seed": 123,
    "artifacts": [],
    "hashes": {},
    "started": "2025-09-16T22:34:56Z",
    "ended": "2025-09-16T22:34:56Z",
    "prompt_id": "sha256:578a2f652089",
    "notes": "fanout_generate"
  },
  {
    "run_id": "run_2025-09-16T22-34-56Z",
    "role": "Editor",
    "model": {
      "name": "write-text",
      "provider": "local"
    },
    "artifacts": [
      "/home/runner/work/AI-Workflow-Orchestration/AI-Workflow-Orchestration/runs/run_2025-09-16T22-34-56Z/artifacts/notes/fanout.txt"
    ],
    "hashes": {
      "/home/runner/work/AI-Workflow-Orchestration/AI-Workflow-Orchestration/runs/run_2025-09-16T22-34-56Z/artifacts/notes/fanout.txt": "sha256:8277c13ce99bbd390be14fb97dd9dd4c01b58a25ac4a851c4334aa4904abfbad"
    },
    "started": "2025-09-16T22:34:56Z",
    "ended": "2025-09-16T22:34:56Z",
    "notes": "emit artifact"
  },
  {
    "run_id": "run_2025-09-16T22-34-56Z",
    "role": "Consensus",
    "model": {
      "name": "majority-vote",
      "provider": "local"
    },
    "artifacts": [],
    "hashes": {},
    "started": "2025-09-16T22:34:56Z",
    "ended": "2025-09-16T22:34:56Z",
    "notes": "voters=['echo', 'upper'], agreement_ratio=0.67"
  },
  {
    "run_id": "run_2025-09-16T22-34-56Z",
    "role": "Editor",
    "model": {
      "name": "write-text",
      "provider": "local"
    },
    "artifacts": [
      "/home/runner/work/AI-Workflow-Orchestration/AI-Workflow-Orchestration/runs/run_2025-09-16T22-34-56Z/artifacts/notes/consensus.json"
    ],
    "hashes": {
      "/home/runner/work/AI-Workflow-Orchestration/AI-Workflow-Orchestration/runs/run_2025-09-16T22-34-56Z/artifacts/notes/consensus.json": "sha256:578a2f6520898bbcfc36430440a50f606b68502af89726d17856206c853138dd"
    },
    "started": "2025-09-16T22:34:56Z",
    "ended": "2025-09-16T22:34:56Z",
    "notes": "emit artifact"
  },
  {
    "run_id": "run_2025-09-16T22-34-56Z",
    "role": "Auditor",
    "model": {
      "name": "assert-contains",
      "provider": "local"
    },
    "artifacts": [],
    "hashes": {},
    "started": "2025-09-16T22:34:56Z",
    "ended": "2025-09-16T22:34:56Z",
    "notes": "must_include=['battery lasts all day', 'ui is confusing']; missing=[]"
  },
  {
    "run_id": "run_2025-09-16T22-34-56Z",
    "role": "Auditor",
    "model": {
      "name": "human-gate",
      "provider": "local"
    },
    "artifacts": [],
    "hashes": {},
    "started": "2025-09-16T22:34:56Z",
    "ended": "2025-09-16T22:34:56Z",
    "notes": "checklist=templates/audit-checklist.md"
  }
]